{
  "$schema": "https://json-schema.org/draft/2020-12/schema",
  "$id": "https://local.schemas.maple-automation.local/ci-evidence.schema.json",
  "title": "Maple Automation Core CI Evidence Metadata",
  "description": "A reproducible record of one local or GitHub Actions quality run and its content-addressed artifacts.",
  "type": "object",
  "$defs": {
    "version": {
      "type": "string",
      "pattern": "^\\d+\\.\\d+\\.\\d+$"
    },
    "sha256": {
      "type": "string",
      "pattern": "^[A-Fa-f0-9]{64}$"
    },
    "gitCommit": {
      "type": "string",
      "pattern": "^[A-Fa-f0-9]{40}$"
    },
    "id": {
      "type": "string",
      "pattern": "^[A-Za-z0-9][A-Za-z0-9._-]{2,128}$"
    },
    "timestamp": {
      "type": "string",
      "format": "date-time",
      "pattern": "^\\d{4}-\\d{2}-\\d{2}T\\d{2}:\\d{2}:\\d{2}(?:\\.\\d+)?(?:Z|[+-]\\d{2}:\\d{2})$"
    },
    "portablePath": {
      "type": "string",
      "minLength": 1,
      "pattern": "^(?!/)(?![A-Za-z]:)(?!\\\\)(?!.*\\\\)(?!.*(?:^|/)\\.\\.?(?:/|$)).+$"
    },
    "check": {
      "type": "object",
      "required": [
        "name",
        "status",
        "command"
      ],
      "properties": {
        "name": {
          "type": "string",
          "minLength": 1
        },
        "status": {
          "type": "string",
          "enum": [
            "passed",
            "failed",
            "skipped"
          ]
        },
        "command": {
          "type": "string",
          "minLength": 1
        },
        "duration_seconds": {
          "type": "number",
          "minimum": 0
        },
        "details": {
          "type": "object",
          "additionalProperties": true
        }
      },
      "additionalProperties": false
    },
    "artifact": {
      "type": "object",
      "required": [
        "artifact_id",
        "name",
        "kind",
        "path",
        "size_bytes",
        "sha256"
      ],
      "properties": {
        "artifact_id": {
          "$ref": "#/$defs/id"
        },
        "name": {
          "type": "string",
          "minLength": 1
        },
        "kind": {
          "type": "string",
          "enum": [
            "junit",
            "coverage",
            "wheel",
            "sdist",
            "manifest",
            "asset-index",
            "evidence-index",
            "evidence-report",
            "dependency-lock",
            "bundle",
            "other"
          ]
        },
        "path": {
          "$ref": "#/$defs/portablePath"
        },
        "size_bytes": {
          "type": "integer",
          "minimum": 0
        },
        "sha256": {
          "$ref": "#/$defs/sha256"
        },
        "retention_days": {
          "type": "integer",
          "minimum": 1
        },
        "upload_name": {
          "type": "string",
          "minLength": 1
        }
      },
      "additionalProperties": false
    }
  },
  "required": [
    "schema_version",
    "evidence_id",
    "workflow_name",
    "event",
    "run_id",
    "run_attempt",
    "source_commit",
    "runner_os",
    "python_version",
    "dependency_install_result",
    "status",
    "checks",
    "artifacts",
    "started_at",
    "completed_at",
    "generated_at"
  ],
  "properties": {
    "schema_version": {
      "$ref": "#/$defs/version"
    },
    "evidence_id": {
      "$ref": "#/$defs/id"
    },
    "workflow_name": {
      "type": "string",
      "minLength": 1
    },
    "event": {
      "type": "string",
      "enum": [
        "pull_request",
        "push",
        "workflow_dispatch",
        "local"
      ]
    },
    "run_id": {
      "type": "string",
      "pattern": "^[0-9]+$"
    },
    "run_attempt": {
      "type": "string",
      "pattern": "^[0-9]+$"
    },
    "source_commit": {
      "$ref": "#/$defs/gitCommit"
    },
    "bundle_id": {
      "$ref": "#/$defs/id"
    },
    "release_id": {
      "$ref": "#/$defs/id"
    },
    "runner_os": {
      "type": "string",
      "minLength": 1
    },
    "python_version": {
      "type": "string",
      "pattern": "^\\d+\\.\\d+\\.\\d+$"
    },
    "dependency_install_result": {
      "type": "string",
      "enum": [
        "passed",
        "failed"
      ]
    },
    "status": {
      "type": "string",
      "enum": [
        "passed",
        "failed",
        "cancelled"
      ]
    },
    "checks": {
      "type": "array",
      "minItems": 1,
      "items": {
        "$ref": "#/$defs/check"
      }
    },
    "artifacts": {
      "type": "array",
      "items": {
        "$ref": "#/$defs/artifact"
      }
    },
    "started_at": {
      "$ref": "#/$defs/timestamp"
    },
    "completed_at": {
      "$ref": "#/$defs/timestamp"
    },
    "generated_at": {
      "$ref": "#/$defs/timestamp"
    }
  },
  "additionalProperties": false
}
